id,title,year,rating,category,cast,director,summary,poster,created_at,updated_at
393,Proof,2005,3,Dramas,"Gwyneth Paltrow, Anthony Hopkins, Jake Gyllenhaal, Danny McCarthy, Hope Davis, Tobiasz Daszkiewicz, Gary Houston, Anne Wittman, Leigh Zimmerman, Colin Stinton",John Madden,"A devoted daughter must face her fears as she comes to terms with the death of her father, a brilliant mathematician crippled by mental instability.",http://netflixroulette.net/api/posters/70011218.jpg,2016-04-29 16:22:15 UTC,2016-04-29 16:22:15 UTC
394,Edison Force,2005,3,Thrillers,"Morgan Freeman, Kevin Spacey, Justin Timberlake, LL Cool J, Dylan McDermott, John Heard, Cary Elwes, Roselyn Sanchez, Piper Perabo",David J. Burke,"Justin Timberlake, in his feature-film debut, stars as a reporter fresh from journalism school who uncovers a hot story of lies and deception within the Edison police department, and does everything in his power to unravel it.",http://netflixroulette.net/api/posters/70050838.jpg,2016-04-29 16:22:15 UTC,2016-04-29 16:22:15 UTC
395,The Usual Suspects,1995,4,Oscar-winning Movies,"Kevin Spacey, Gabriel Byrne, Stephen Baldwin, Kevin Pollak, Chazz Palminteri, Benicio Del Toro, Pete Postlethwaite, Suzy Amis, Giancarlo Esposito, Dan Hedaya",Bryan Singer,"When five unacquainted crooks are hauled into a police station to appear in a criminal lineup, they decide to pull off a heist together. The plan gets complicated, however, when they intermix with an underworld kingpin named Keyser S&#246;ze.",http://netflixroulette.net/api/posters/1084379.jpg,2016-04-29 16:22:15 UTC,2016-04-29 16:22:15 UTC
396,The Shipping News,2001,3,Dramas,"Kevin Spacey, Julianne Moore, Judi Dench, Cate Blanchett, Pete Postlethwaite, Scott Glenn, Rhys Ifans, Gordon Pinsent, Jason Behr, Larry Pine",Lasse Hallström,"Distraught after the disappearance of his estranged wife, Quoyle and his daughter move into their ancestral home with his long-lost aunt in Newfoundland, where life is rough and secrets are buried deep.",http://netflixroulette.net/api/posters/60021795.jpg,2016-04-29 16:22:15 UTC,2016-04-29 16:22:15 UTC
397,Swimming with Sharks,1994,3,Comedies,"Frank Whaley, Kevin Spacey, Michelle Forbes, Benicio Del Toro, T.E. Russell, Roy Dotrice, Matthew Flint, Patrick Fischler, Jerry Levine",George Huang,"Naive Guy lands a job as assistant to Buddy Ackerman, a repulsive studio exec who turns Guy's daily routine into a pride-swallowing siege. Guy is eager to climb the ladder of success, but Buddy stops at nothing to grab credit and foil Guy's plans.",http://netflixroulette.net/api/posters/337079.jpg,2016-04-29 16:22:15 UTC,2016-04-29 16:22:15 UTC
398,Inseparable,2011,3,Comedies,"Kevin Spacey, Daniel Wu, Beibi Gong, Ni Yan, Peter Stormare, Kenneth Tsang, Mo Zhang, Tongsheng Han",Dayyan Eng,"Plagued by personal tragedies and troubles at work, Li is on the brink of ending it all until his expat neighbor gives him a new lease on life. Forging an unlikely bond, the two men don superhero costumes and anoint themselves crime fighters.",http://netflixroulette.net/api/posters/70235759.jpg,2016-04-29 16:22:15 UTC,2016-04-29 16:22:15 UTC
399,Glengarry Glen Ross,1992,3,Dramas,"Al Pacino, Jack Lemmon, Alec Baldwin, Alan Arkin, Ed Harris, Kevin Spacey, Jonathan Pryce, Bruce Altman, Jude Ciccolella",James Foley,"Jack Lemmon, Al Pacino, Ed Harris and Alan Arkin chew the words of David Mamet's script (based on his own stage play) as a group of Chicago real estate salesmen vying for the best ""leads"" at a small firm that sells property in resort areas.",http://netflixroulette.net/api/posters/60010399.jpg,2016-04-29 16:22:15 UTC,2016-04-29 16:22:15 UTC
400,Casino Jack,2010,3,Dramas,"Kevin Spacey, Barry Pepper, Kelly Preston, Jon Lovitz, Rachelle Lefevre, Ruth Marshall, Graham Greene, Hannah Endicott-Douglas, John Robinson, Jason Weinberg",George Hickenlooper,"No stranger to wealth and power, slick lobbyist Jack Abramoff lands deep in a political corruption scandal after bilking millions from Indian tribes. Greed and vanity catch up to the charismatic Abramoff in the form of the mob, the media and the law.",http://netflixroulette.net/api/posters/70122321.jpg,2016-04-29 16:22:15 UTC,2016-04-29 16:22:15 UTC
401,House of Cards: Season 1 (Recap),2014,3,TV Shows,"Kevin Spacey, Robin Wright, Kate Mara, Corey Stoll, Michael Kelly, Sakina Jaffrey, Kristen Connolly, Constance Zimmer, Sebastian Arcelus, Nathan Darrow","","Enraged when the newly-elected president publicly betrays him, veteran Congressman Frank Underwood makes a secret pledge to exact revenge and seize the reins of power through a complex plot of manipulation, deceit and corruption.",http://netflixroulette.net/api/posters/70296335.jpg,2016-04-29 16:22:15 UTC,2016-04-29 16:22:15 UTC
402,House of Cards: Season 1 with Bonus Commentary,2013,3,TV Shows,"Kevin Spacey, Robin Wright, Kate Mara, Corey Stoll, Michael Kelly, Sakina Jaffrey, Kristen Connolly, Constance Zimmer, Sebastian Arcelus, Nathan Darrow","","Watch the first season of this Emmy-winning series all over again, this time with scene-by-scene audio commentary from directors including David Fincher and Joel Schumacher, who provide a behind-the-camera analysis for each episode.",http://netflixroulette.net/api/posters/70296495.jpg,2016-04-29 16:22:15 UTC,2016-04-29 16:22:15 UTC
403,American Masters: Johnny Carson: King of Late Night,2012,4,TV Shows,"Kevin Spacey, Johnny Carson, Steve Allen, Jay Leno, Jimmy Fallon, David Letterman, Conan O'Brien","Peter Jones, Mark A. Catalena","As host of ""The Tonight Show"" for 30 years, Johnny Carson was seen by more people on more occasions than anyone else in American history. Explore Carson's life and career, as well as the history of his beloved television program.",http://netflixroulette.net/api/posters/70241454.jpg,2016-04-29 16:22:15 UTC,2016-04-29 16:22:15 UTC
404,House of Cards,2013,4,TV Shows,"Kevin Spacey, Robin Wright, Kate Mara, Corey Stoll, Michael Kelly, Sakina Jaffrey, Kristen Connolly, Constance Zimmer, Sebastian Arcelus, Nathan Darrow","","Ruthless Congressman Francis Underwood and his ambitious wife Claire will stop at nothing to conquer Washington D.C. in this dark political drama, winner of three Emmy Awards, including Best Director, and a Golden Globe for Best Actress. Season 2 begins February 14.",http://netflixroulette.net/api/posters/70178217.jpg,2016-04-29 16:22:15 UTC,2016-04-29 16:22:15 UTC
405,American Beauty,1999,3,Dramas,"Kevin Spacey, Annette Bening, Thora Birch, Wes Bentley, Mena Suvari, Chris Cooper, Peter Gallagher, Allison Janney, Scott Bakula, Sam Robards, Ara Celi, John Cho, Sue Casey, Amber Smith, Matthew Kimbrough",Sam Mendes,"While struggling to endure his tightly wound wife, an unfulfilling job and a surly teen, a man becomes obsessed with one of his daughter's friends.",http://netflixroulette.net/api/posters/60000407.jpg,2016-04-29 16:22:15 UTC,2016-04-29 16:22:15 UTC
406,The Ref,1994,3,Comedies,"Denis Leary, Judy Davis, Kevin Spacey, Robert J. Steinmiller Jr., Glynis Johns, Raymond J. Barry, Richard Bright, Christine Baranski, Adam LeFevre, Phillip Nicoll, Ellie Raab, Bill Raymond",Ted Demme,"Gus, a burglar, is about to score on Christmas Eve by breaking into a posh home in the suburbs. But his plans change when he trips up the alarm and takes the occupants hostage. Or is it the other way around?",http://netflixroulette.net/api/posters/60026336.jpg,2016-04-29 16:22:15 UTC,2016-04-29 16:22:15 UTC
407,Now: In the Wings on a World Stage,2014,3,Documentaries,"Kevin Spacey, Maureen Anderman, Stephen Lee Anderson, Jeremy Bobb, Nathan Darrow, Jack Ellis, Annabel Scholey, Gavin Stenhouse, Hannah Stokely, Sam Mendes, Gary Powell, Chukwudi Iwuji, Isaiah Johnson, Gemma Jones",Jeremy Whelehan,"Go behind the scenes with leading man Kevin Spacey, director Sam Mendes and their collaborators on the Bridge Project's production of ""Richard III.""",http://netflixroulette.net/api/posters/80005820.jpg,2016-04-29 16:22:15 UTC,2016-04-29 16:22:15 UTC
408,Prozac Nation,2001,3,Dramas,"Christina Ricci, Jessica Lange, Jonathan Rhys Meyers, Jason Biggs, Anne Heche, Michelle Williams",Erik Skjoldbjaerg,This adaptation of Elizabeth Wurtzel's memoir stars Christina Ricci as a girl on the verge of losing her grip on life after she leaves her emotionally unstable home for college. Her psychiatrist prescribes Prozac ... but is that her only choice?,http://netflixroulette.net/api/posters/60022960.jpg,2016-04-29 16:22:15 UTC,2016-04-29 16:22:15 UTC
409,But I'm a Cheerleader,1999,3,Comedies,"Natasha Lyonne, Clea DuVall, RuPaul, Bud Cort, Michelle Williams, Melanie Lynskey, Mink Stole, Cathy Moriarty, Robert Pine",Jamie Babbit,"A ""normal"" teen cheerleader dating the football captain draws suspicion from parents and friends who think she's gay. Shipped off to a camp designed to shove her back in the closet, she meets a tomboy who helps her recognize her sexual orientation.",http://netflixroulette.net/api/posters/60000863.jpg,2016-04-29 16:22:15 UTC,2016-04-29 16:22:15 UTC
410,Take This Waltz,2011,3,Dramas,"Michelle Williams, Seth Rogen, Luke Kirby, Sarah Silverman, Jennifer Podemski, Diane D'Aquila, Vanessa Coelho, Graham Abbey",Sarah Polley,"Filmed in Toronto, this intimate, unflashy romantic drama portrays a happily married woman who experiences a sudden and strong desire for another man. Further complicating the situation, the object of her desire resides just across the street.",http://netflixroulette.net/api/posters/70209166.jpg,2016-04-29 16:22:15 UTC,2016-04-29 16:22:15 UTC
411,What My Husband Doesn't Know,2012,3,Dramas,"Bryan White, Michelle Williams, Ann Nesby, Clifton Davis, Tiffany Haddish, Diondre Jones, Esau McGraw, Chloe Spencer",David E. Talbert,All the money and material things her successful husband provides don't make up for the emptiness Lena feels from his frequent absences -- and she soon finds herself tempted by a good-looking young handyman working in her home.,http://netflixroulette.net/api/posters/70223595.jpg,2016-04-29 16:22:15 UTC,2016-04-29 16:22:15 UTC
412,Dawson's Creek,1998,3,TV Shows,"James Van Der Beek, Katie Holmes, Michelle Williams, Joshua Jackson, Mary Beth Peil, Kerr Smith, Mary-Margaret Humes, Nina Repeta, John Wesley Shipp, Meredith Monroe","","This thought-provoking nighttime soap about a group of close-knit teens, led by dreamer Dawson Leery, frankly portrays the issues of adolescence that obsess young adults as they navigate through high school and college -- including sex, sex and sex.",http://netflixroulette.net/api/posters/70157460.jpg,2016-04-29 16:22:15 UTC,2016-04-29 16:22:15 UTC
413,Spanish Fly,1998,2,Comedies,"Daphna Kastner, Toni Cantó, Antonio Castro, Martin Donovan, Danny Huston",Daphna Kastner,"An American journalist, Zoe (played by the multitalented Daphna Kastner, who also wrote and directed the film), knows better than to go into a story with her mind already made up. But that's exactly what she does when she heads off to Spain to write about its men and their macho take (as she sees it) on relationships. As she tries to prove her thesis, she soon realizes that she doesn't know as much about the male sex as she thought.",http://netflixroulette.net/api/posters/70012636.jpg,2016-04-29 16:22:15 UTC,2016-04-29 16:22:15 UTC
414,Duress,2009,3,Independent Movies,"Martin Donovan, Sakis Rouvas, Billy Wirth, Catherine Dent, Chelsea Smith, Ariel Winter, Gina Gallego, Cole S. McKay, Alexis Raich, George Ketsios",Jordan Barker,"Grieving after his wife's recent suicide, Richard Barnett (Martin Donovan) witnesses a brutal killing by the charismatic Abner Solvie (Sakis Rouvas). The widower's troubles multiply when Abner forces him to become his criminal protege by threatening to execute Richard's daughter (Ariel Winter). In order to keep her alive, Richard must behave like his psychotic captor in this tautly suspenseful thriller.",http://netflixroulette.net/api/posters/70124576.jpg,2016-04-29 16:22:15 UTC,2016-04-29 16:22:15 UTC
415,Silent Hill: Revelation,2012,3,Horror Movies,"Adelaide Clemens, Kit Harington, Carrie-Anne Moss, Sean Bean, Radha Mitchell, Malcolm McDowell, Martin Donovan, Deborah Kara Unger",Michael J. Bassett,"Haunted by shocking nightmares and unsettled by her father's disappearance just before her 18th birthday, Heather goes on the hunt for him -- and discovers a disturbing truth about her own identity in this suspenseful sequel to the hit horror flick.",http://netflixroulette.net/api/posters/70243446.jpg,2016-04-29 16:22:15 UTC,2016-04-29 16:22:15 UTC
416,Pipe Dream,2002,3,Comedies,"Martin Donovan, Mary-Louise Parker, Rebecca Gayheart, Kevin Carroll, Peter Jacobson, Guinevere Turner, Jill Hennessy, Anthony Arkin, Marla Sucharetza, Kevin Sussman",John Walsh,"After having a one-night-stand with an aspiring screenwriter, a New York City plumber, frustrated about the way his vocation is perceived by women, steals the writer's script and poses as a director to improve his chances in the dating arena.",http://netflixroulette.net/api/posters/60024972.jpg,2016-04-29 16:22:15 UTC,2016-04-29 16:22:15 UTC
417,Collaborator,2011,2,Dramas,"Martin Donovan, David Morse, Olivia Williams, Melissa Auf Der Maur, Eileen Ryan, Julian Richings, Katherine Helmond",Martin Donovan,"After critics savage his latest Broadway play, writer Robert Longfellow heads home to Los Angeles to care for his mother and work on schlocky movies. But when he runs into an old neighbor, his life takes a terrifying Hollywood-style plot turn.",http://netflixroulette.net/api/posters/70247840.jpg,2016-04-29 16:22:15 UTC,2016-04-29 16:22:15 UTC
418,Boss,2011,3,TV Shows,"Kelsey Grammer, Connie Nielsen, Kathleen Robertson, Hannah Ware, Jeff Hephner, Martin Donovan, Francis Guinan, Rotimi, Troy Garity, James Vincent Meredith","","Kelsey Grammer stars in this dark drama as Chicago mayor Tom Kane, a viperous politician unafraid to step outside the law when it suits his interests.",http://netflixroulette.net/api/posters/70211213.jpg,2016-04-29 16:22:15 UTC,2016-04-29 16:22:15 UTC
419,Sabotage,2014,3,Dramas,"Arnold Schwarzenegger, Sam Worthington, Olivia Williams, Terrence Howard, Joe Manganiello, Josh Holloway, Mireille Enos, Harold Perrineau, Martin Donovan, Max Martini",David Ayer,"With Arnold Schwarzenegger lending his intimidating presence, this action drama tracks a crack team of DEA agents plotting their own heist.",http://netflixroulette.net/api/posters/70287290.jpg,2016-04-29 16:22:15 UTC,2016-04-29 16:22:15 UTC
420,Insomnia,2002,3,Thrillers,"Al Pacino, Robin Williams, Hilary Swank, Oliver 'Ole' Zemen, Martin Donovan, Paul Dooley, Nicky Katt, Larry Holden, Maura Tierney, Jonathan Jackson, Jay Brazeau, Katharine Isabelle",Christopher Nolan,"Sent to investigate a teenage girl's murder in a small Alaska town, a detective accidentally shoots his partner while trying to apprehend a suspect.",http://netflixroulette.net/api/posters/60022968.jpg,2016-04-29 16:22:15 UTC,2016-04-29 16:22:15 UTC
421,Panic Room,2002,3,Thrillers,"Jodie Foster, Kristen Stewart, Forest Whitaker, Dwight Yoakam, Jared Leto, Patrick Bauchau, Ann Magnuson, Ian Buchanan, Andrew Kevin Walker, Paul Schulze",David Fincher,"A woman and her daughter are caught in a game of cat-and-mouse with three burglars in their New York City home and are forced to retreat inside a vault. As the intruders try to breach the room's security, the embattled duo must stay one step ahead.",http://netflixroulette.net/api/posters/60022700.jpg,2016-04-29 16:22:15 UTC,2016-04-29 16:22:15 UTC
422,Blank City,2010,3,Documentaries,"Amos Poe, Ann Magnuson, Deborah Harry, Fab 5 Freddy, Jim Jarmusch, John Lurie, John Waters, Steve Buscemi, Susan Seidelman, Lydia Lunch",Celine Danhier,"Filmmaker Celine Danhier directs this lively documentary that retraces the birth of the underground film movement in New York in the early 1980s, spurred by the work of artists like Richard Kern, Casandra Stark and John Waters.",http://netflixroulette.net/api/posters/70117055.jpg,2016-04-29 16:22:15 UTC,2016-04-29 16:22:15 UTC
423,The Human Stain,2003,3,Dramas,"Nicole Kidman, Anthony Hopkins, Ed Harris, Gary Sinise, Mili Avital, Harry Lennix, Anna Deavere Smith, Kerry Washington, Ron Canada, John Finn",Robert Benton,"A university classics professor becomes involved in a passionate relationship with a poor cleaning woman who's married to a jealous, violent man.",http://netflixroulette.net/api/posters/60031219.jpg,2016-04-29 16:22:15 UTC,2016-04-29 16:22:15 UTC
424,Peeples,2013,3,Comedies,"Craig Robinson, Kerry Washington, David Alan Grier, S. Epatha Merkerson, Tyler James Williams, Melvin Van Peebles, Diahann Carroll, Kali Hawk, Kimrie Lewis-Davis, Malcolm Barrett",Tina Gordon Chism,"Hoping to propose to his upper-crust girlfriend, Wade Walker crashes her family's annual reunion and lands in a face-off with her dad, Judge Peeples.",http://netflixroulette.net/api/posters/70242806.jpg,2016-04-29 16:22:15 UTC,2016-04-29 16:22:15 UTC
425,Our Song,2000,3,Dramas,"Melissa Martinez, Anna Simpson, Kerry Washington, Marlene Forte, Raymond Anthony Thomas, Rosalyn Coleman, Carmen Lopez, Tyrone Brown",Jim McKay,"Experiencing growing pains while they're on summer vacation, three inner-city teenage girls with hectic schedules make life-changing decisions in this engrossing drama that encapsulates the untold difficulties of urban living.",http://netflixroulette.net/api/posters/60020853.jpg,2016-04-29 16:22:15 UTC,2016-04-29 16:22:15 UTC
426,The Details,2011,3,Comedies,"Tobey Maguire, Elizabeth Banks, Laura Linney, Ray Liotta, Kerry Washington, Dennis Haysbert, Christopher Curry, Gary Schwartz, José Gandara, Miles Ellenwood",Jacob Aaron Estes,"After discovering that his lawn has been completely destroyed by raccoons, frustrated Jeff foolishly cheats on his wife, Nealy, which leads to a series of agonizing predicaments involving his best friend's husband and next-door neighbor.",http://netflixroulette.net/api/posters/70138624.jpg,2016-04-29 16:22:15 UTC,2016-04-29 16:22:15 UTC
427,Night Catches Us,2010,3,Dramas,"Kerry Washington, Anthony Mackie, Wendell Pierce, Jamie Hector, Tariq Trotter, Amari Cheatom, Ron Simons, Thomas Roy, Nakia Dillard, Whitney Wilcox",Tanya Hamilton,"After growing up during the tumultuous 1960s, ex-Black Panther Marcus (Anthony Mackie) returns to his home in Philadelphia in 1976 and reconnects with Pat (Kerry Washington), the widow of a Panther leader. Marcus befriends Pat's young daughter and attempts to conquer his demons. Interfering with Marcus's good intentions are the neighborhood's continuing racial and social conflicts, as well as old enemies and friends -- both with scores to settle.",http://netflixroulette.net/api/posters/70129370.jpg,2016-04-29 16:22:15 UTC,2016-04-29 16:22:15 UTC
428,Scandal,2012,4,TV Shows,"Kerry Washington, Columbus Short, Darby Stanchfield, Katie Lowes, Guillermo Díaz, Joshua Malina, Jeff Perry, Bellamy Young, Tony Goldwyn","","Olivia Pope leads a team of Washington, D.C., lawyers who specialize in making scandals disappear. As they secretly handle crises at the highest levels of government, the dysfunctional team must also cope with problems closer to home.",http://netflixroulette.net/api/posters/70197057.jpg,2016-04-29 16:22:15 UTC,2016-04-29 16:22:15 UTC
429,Little Man,2006,3,Comedies,"Marlon Wayans, Shawn Wayans, Kerry Washington, John Witherspoon, Tracy Morgan, Lochlyn Munro, Chazz Palminteri, Molly Shannon, David Alan Grier, Dave Sheridan",Keenen Ivory Wayans,"A man is so eager to become a dad that he'll believe anything, including the notion that a baby-faced thief on the lam is really an abandoned toddler.",http://netflixroulette.net/api/posters/70044593.jpg,2016-04-29 16:22:15 UTC,2016-04-29 16:22:15 UTC
430,Jamesy Boy,2014,3,Dramas,"Mary-Louise Parker, Taissa Farmiga, James Woods, Ving Rhames, Spencer Lofranco, Rosa Salazar, Taboo, Ben Rosenfield, Michael Trotter",Trevor White,An angry teen winds up in prison for running drugs and guns -- but his friendship with a killer gives him a chance to change his life for the better.,http://netflixroulette.net/api/posters/70297647.jpg,2016-04-29 16:22:15 UTC,2016-04-29 16:22:15 UTC
431,Diggstown,1992,3,Comedies,"James Woods, Heather Graham, Louis Gossett Jr., Bruce Dern, Oliver Platt, Randall Tex Cobb, Thomas Wilson Brown",Michael Ritchie,"When two swindlers involve an aging boxer in a plan to dupe a rich Diggstown resident, the fighter first makes the con men earn their stripes.",http://netflixroulette.net/api/posters/444118.jpg,2016-04-29 16:22:15 UTC,2016-04-29 16:22:15 UTC
432,Riding in Cars with Boys,2001,3,Dramas,"Drew Barrymore, Steve Zahn, Brittany Murphy, Adam Garcia, Lorraine Bracco, James Woods, Sara Gilbert, Desmond Harrington, David Moscow, Maggie Gyllenhaal",Penny Marshall,"After sleeping with a boy she barely knew, Beverly gets married on a whim and discovers that her newborn isn't the only one who has a lot of growing up to do. Her teenage husband is a still a kid -- and so is she.",http://netflixroulette.net/api/posters/60021641.jpg,2016-04-29 16:22:15 UTC,2016-04-29 16:22:15 UTC
433,The Hard Way,1991,3,Action & Adventure,"Michael J. Fox, James Woods, Stephen Lang, Annabella Sciorra, Penny Marshall",John Badham,"An actor needs to get under a cop's skin to research an upcoming role, and he picks an irritable New York City hard case as his source material. As if dealing with the pesky thespian weren't enough, the cop has a serial killer to catch.",http://netflixroulette.net/api/posters/572991.jpg,2016-04-29 16:22:15 UTC,2016-04-29 16:22:15 UTC
434,Scary Movie 2,2001,3,Comedies,"Shawn Wayans, Marlon Wayans, Anna Faris, Regina Hall, Christopher Masterson, Kathleen Robertson, David Cross, James Woods, Tim Curry, Tori Spelling",Keenen Ivory Wayans,"While the original parodied slasher flicks like Scream, Keenen Ivory Wayans' sequel to Scary Movie takes comedic aim at haunted house movies. A group of students visits a mansion called Hell House, and murderous high jinks ensue.",http://netflixroulette.net/api/posters/60020813.jpg,2016-04-29 16:22:15 UTC,2016-04-29 16:22:15 UTC
435,The Virgin Suicides,1999,3,Dramas,"James Woods, Kathleen Turner, Kirsten Dunst, Josh Hartnett, Michael Paré, Scott Glenn, Danny DeVito, A.J. Cook, Hanna Hall, Leslie Hayman",Sofia Coppola,"Ronald and Sara Lisbon are raising five alluring, adolescent daughters on a short leash in 1970s suburbia. When the youngest, Cecilia, kills herself, Sara attempts to shelter the rest of them from intrigued neighborhood boys.",http://netflixroulette.net/api/posters/60000909.jpg,2016-04-29 16:22:15 UTC,2016-04-29 16:22:15 UTC
436,Another Day in Paradise,1998,3,Dramas,"James Woods, Melanie Griffith, Vincent Kartheiser, Natasha Gregson Wagner, James Otis, Branden Williams, Brent Briscoe, Peter Sarsgaard, Paul Hipp, Kim Flowers",Larry Clark,"Injured in the middle of a break-in, Bobbie and his girlfriend Rosie are taken in by an older junkie couple, Mel and Sid, who enlist them to help in a drug robbery. The four go on the road together, but their allegiance soon begins to crumble.",http://netflixroulette.net/api/posters/17236541.jpg,2016-04-29 16:22:15 UTC,2016-04-29 16:22:15 UTC
437,Hercules,1997,4,Children & Family Movies,"Tate Donovan, Danny DeVito, James Woods, Susan Egan, Bobcat Goldthwait, Matt Frewer, Rip Torn, Samantha Eggar, Barbara Barrie, Hal Holbrook","Ron Clements, John Musker","In Disney's animated take on Greek mythology, the heavenly Hercules is stripped of his immortality and raised on Earth instead of Olympus, where he's forced to take on Hades and assorted monsters.",http://netflixroulette.net/api/posters/1171557.jpg,2016-04-29 16:22:15 UTC,2016-04-29 16:22:15 UTC
438,The General's Daughter,1999,3,Thrillers,"John Travolta, Madeleine Stowe, James Cromwell, Timothy Hutton, Leslie Stefanson, Daniel von Bargen, Clarence Williams III, James Woods, Peter Weireter, Mark Boone Junior",Simon West,"Respected Army Gen. Joe Campbell is headed for a hero's retirement -- until his daughter is raped and murdered on his military base, and warrant officers and ex-lovers Paul Brenner and Sara Sunhill are given 36 hours to solve the convoluted case.",http://netflixroulette.net/api/posters/22469006.jpg,2016-04-29 16:22:15 UTC,2016-04-29 16:22:15 UTC
439,The Onion Field,1979,3,Dramas,"John Savage, James Woods, Franklyn Seales, Ted Danson, Ronny Cox, David Huffman, Christopher Lloyd, Dianne Hull, Priscilla Pointer",Harold Becker,"This true story follows the psychological collapse of cop Karl, whose partner is murdered in front of him. Karl tries to put his life back together while wrestling with the guilt of surviving the ordeal and letting the killers get away.",http://netflixroulette.net/api/posters/60023743.jpg,2016-04-29 16:22:15 UTC,2016-04-29 16:22:15 UTC
440,And Your Name Is Jonah,1979,3,Dramas,"Sally Struthers, James Woods, Randee Heller, Titos Vandis, Penny Santon, Ruth Manning, Jeffrey Bravin, Robert Davi",Richard Michaels,"Deaf youngster Jonah Corelli (Jeffrey Bravin) was tragically misdiagnosed as mentally retarded when he was a boy, leading to years of frustration for both Jonah and his parents (James Woods and Sally Struthers). When the boy's abilities are recognized, Jonah's world opens as he learns sign language. Jonah's struggles to make himself understood provide an affecting, heart-rending family drama with an important message.",http://netflixroulette.net/api/posters/70147018.jpg,2016-04-29 16:22:15 UTC,2016-04-29 16:22:15 UTC
