id,title,year,rating,category,cast,director,summary,poster,created_at,updated_at
1074,Airplane II: The Sequel,1982,3,Comedies,"Robert Hays, Julie Hagerty, Lloyd Bridges, Chad Everett, Peter Graves, Chuck Connors, William Shatner, Raymond Burr, John Vernon, Stephen Stucker",Ken Finkleman,"In this sequel to the wildly popular farce Airplane!, pilot Ted Striker (Robert Hays) knows that the first commercial spaceflight to the moon is headed for disaster. Fighting his fears, he races to save the passengers and win back his ex-girlfriend (Julie Hagerty). Lloyd Bridges reprises his role as the chain-smoking, amphetamine-popping, glue-sniffing airport controller, while William Shatner, Raymond Burr and Sonny Bono are among those on board.",http://netflixroulette.net/api/posters/60002834.jpg,2016-05-02 20:45:29 UTC,2016-05-02 20:45:29 UTC
1075,Airplane!,1980,3,Comedies,"Robert Hays, Julie Hagerty, Lloyd Bridges, Leslie Nielsen, Peter Graves, Robert Stack, Kareem Abdul-Jabbar, Lorna Patterson, Stephen Stucker, Ethel Merman","Jim Abrahams, David Zucker, Jerry Zucker","In this classic, joke-a-second parody of disaster movies, traumatized former combat pilot Ted Striker, an airplane passenger, is forced to land the plane when food poisoning strikes the crew and there's no one else on board who can do the job.",http://netflixroulette.net/api/posters/60002777.jpg,2016-05-02 20:45:29 UTC,2016-05-02 20:45:29 UTC
1076,Disaster on the Coastliner,1979,3,Action & Adventure,"Lloyd Bridges, Raymond Burr, Robert Fuller, Pat Hingle, E.G. Marshall, Yvette Mimieux, William Shatner, Paul L. Smith",Richard Sarafian,"Two trains, one charging from Los Angeles, the other from San Francisco, barrel toward each other on a single track, and hamstrung railway execs realize too late that deranged engineer Jim Waterman (Paul L. Smith) has sabotaged the computer-locked line. In this 1970s hair-raiser, dispatchers fumble, secret serviceman Al Mitchell (Lloyd Bridges) throws his weight around, and con man Stuart Peters (William Shatner) isn't all that he appears to be.",http://netflixroulette.net/api/posters/70147020.jpg,2016-05-02 20:45:29 UTC,2016-05-02 20:45:29 UTC
1077,High Noon,1952,3,Classic Movies,"Gary Cooper, Thomas Mitchell, Lloyd Bridges, Katy Jurado, Grace Kelly, Otto Kruger, Lon Chaney Jr., Harry Morgan, Ian MacDonald",Fred Zinnemann,"A retiring marshal insists on defending his town from a gang of hooligans, but faces the task alone as the cowardly townspeople flee in horror.",http://netflixroulette.net/api/posters/589258.jpg,2016-05-02 20:45:29 UTC,2016-05-02 20:45:29 UTC
1078,Ride Out For Revenge,1957,3,Dramas,"Rory Calhoun, Gloria Grahame, Lloyd Bridges, Joanne Gilbert, Frank DeKova, Vince Edwards, Michael Winkelman, Richard Shannon, Cyril Delevanti",Bernard Girard,"A corrupt cavalry officer leads the relocation of the Cheyenne to a reservation but, when gold is discovered on the land, they may be in for a fight.",http://netflixroulette.net/api/posters/80022450.jpg,2016-05-02 20:45:29 UTC,2016-05-02 20:45:29 UTC
1079,Breathe In,2013,2,Independent Movies,"Guy Pearce, Felicity Jones, Amy Ryan, Mackenzie Davis, Matthew Daddario, Ben Shenkman, Kyle MacLachlan, Alexandra Wentworth",Drake Doremus,Music teacher Keith has his mind focused on the past when he and his wife agree to welcome a foreign exchange student into their household.,http://netflixroulette.net/api/posters/70267238.jpg,2016-05-02 20:45:29 UTC,2016-05-02 20:45:29 UTC
1080,Rushlights,2013,3,Thrillers,"Beau Bridges, Haley Webb, Josh Henderson, Aidan Quinn, Jordan Bridges, Lorna Raver, Joel McKinnon Miller, Crispian Belfrage, Philip Lenkowsky, Eileen Grubba",Antoni Stutz,"Young lovers Billy and Sarah journey from L.A. to Texas with plans to make a false claim to the valuable assets left behind by a dead friend. But when their voyage brings them to Tremo, Texas, they find a bizarre and sinister world awaiting them.",http://netflixroulette.net/api/posters/70275790.jpg,2016-05-02 20:45:30 UTC,2016-05-02 20:45:30 UTC
1081,Abduction of Eden,2012,3,Dramas,"Jamie Chung, Matt O'Leary, Beau Bridges, Scott Mechlowicz, Mariana Klaveno, Tantoo Cardinal, Tracey Fairaway, Russell Hodgkinson, Naama Kates, Tony Doupe",Megan Griffiths,"Hyun Jae is still a teenager when she's kidnapped and spirited to Las Vegas, where she's forced to work as a prostitute for the next two years. Renamed Eden by her captors, she works to gain their respect in a bid to win her liberty.",http://netflixroulette.net/api/posters/70234882.jpg,2016-05-02 20:45:30 UTC,2016-05-02 20:45:30 UTC
1082,Boys Klub,2001,3,Children & Family Movies,"Beau Bridges, Tim Cavanaugh, Rachel Hunter, Jarrett Lennon, Chauncey Leopardi, Patrick Renna",Lebrado Baracio,"Sent to San Francisco to spend the summer with his aunt, teenager Mario Vandetti makes fast friends with a group of neighborhood kids and -- encouraged by a caring priest -- they soon form a basketball team, becoming contenders in a city tournament.",http://netflixroulette.net/api/posters/70018977.jpg,2016-05-02 20:45:30 UTC,2016-05-02 20:45:30 UTC
1083,My Girlfriend's Boyfriend,2010,3,Comedies,"Alyssa Milano, Christopher Gorham, Michael Landes, Beau Bridges, Tom Lenk, Carol Kane, Heather Stephens, Kelly Packard",Daryn Tufts,"Jesse Young, a girl who already has everything, finds herself falling for two seemingly perfect guys: sexy but struggling writer Ethan and button-down advertising executive Troy. Can she find true love with two men at the same time?",http://netflixroulette.net/api/posters/70125551.jpg,2016-05-02 20:45:30 UTC,2016-05-02 20:45:30 UTC
1084,Columbus Circle,2011,3,Thrillers,"Selma Blair, Amy Smart, Kevin Pollak, Jason Antoon, Robert Guillaume, Beau Bridges, Giovanni Ribisi, Jason Lee, Jerry Penacoli, Samm Levine",George Gallo,"When her next door neighbor is murdered, an agoraphobic Manhattan heiress who hasn't left her apartment in decades finds herself forced to deal with the detective investigating the case and the new couple who move into the dead woman's apartment.",http://netflixroulette.net/api/posters/70227048.jpg,2016-05-02 20:45:30 UTC,2016-05-02 20:45:30 UTC
1085,The Other Side of the Mountain,1975,3,Classic Movies,"Marilyn Hassett, Beau Bridges, Belinda Montgomery, Nan Martin, Bill Vint, Dabney Coleman, William Bryant, Hampton Fancher, William Roerick, Dori Brenner",Larry Peerce,"Based on a true story, national skiing champion Jill Kinmont's life takes a tragic turn when, during a competition in 1955, the Olympic prospect suffers a near-fatal accident that leaves her paralyzed from the neck down in this made for TV movie.",http://netflixroulette.net/api/posters/60011284.jpg,2016-05-02 20:45:30 UTC,2016-05-02 20:45:30 UTC
1086,Swashbuckler,1976,3,Action & Adventure,"Robert Shaw, James Earl Jones, Peter Boyle, Geneviève Bujold, Beau Bridges, Geoffrey Holder, Avery Schreiber, Tom Clancy, Anjelica Huston",James Goldstone,"A high-seas adventure unfolds as buccaneer Ned Lynch saves his pirate buddy, Nick Debrett, from execution and rescues distressed noblewoman Jane Barnet. The sword-wielding trio then proceeds to Jamaica, where they plot an uprising.",http://netflixroulette.net/api/posters/1017899.jpg,2016-05-02 20:45:30 UTC,2016-05-02 20:45:30 UTC
1087,10.5,2004,3,TV Shows,"Kim Delaney, Fred Ward, Ivan Sergei, Dulé Hill, Beau Bridges, John Schneider, Kaley Cuoco, Rebecca Jenkins, David Cubitt, Brian Markinson","","A 7.9 magnitude earthquake devastates Seattle, Wash. -- and as a follow-up, the 8.4 aftershock wreaks even more havoc, even swallowing a moving train, with potentially more devastating aftershocks to come. Dr. Samantha Hill (Kim Delaney), an expert on hidden fault lines, and the president of the United States (Beau Bridges) must work together and race against the clock to save millions of Americans in harm's way.",http://netflixroulette.net/api/posters/70248305.jpg,2016-05-02 20:45:30 UTC,2016-05-02 20:45:30 UTC
1088,Sordid Lives,2000,3,Independent Movies,"Newell Alexander, Rosemary Alexander, Bonnie Bedelia, Beau Bridges, Earl Houston Bullock, Delta Burke, Kirk Geiger, Beth Grant, Sarah Hunley, Olivia Newton-John, Ann Walker, Leslie Jordan",Del Shores,"Deftly skewering redneck society, Bonnie Bedelia, Beau Bridges and Delta Burke head the cast in this uproarious satire of Texas white-trash culture.",http://netflixroulette.net/api/posters/60026482.jpg,2016-05-02 20:45:30 UTC,2016-05-02 20:45:30 UTC
1089,1000 to 1: The Cory Weissman Story,2014,4,Dramas,"David Henrie, Luke Kleintank, Beau Bridges, Jean Louisa Kelly, Cassi Thomson, Hannah Marks, Michael Lerner, Myk Watford",Michael Levine,"After a budding college basketball star suffers a catastrophic stroke in his freshman year, he struggles to make a comeback against all odds.",http://netflixroulette.net/api/posters/80010865.jpg,2016-05-02 20:45:30 UTC,2016-05-02 20:45:30 UTC
1090,Storm Rider,2013,4,Children & Family Movies,"Kevin Sorbo, Kristy Swanson, C. Thomas Howell, Danielle Chuchran, Jacob Buster, Darien Willardson, Sam Jenkins, Terence Goodman, Sarah Bernstein, Jacque Gray",Craig Clyde,"Forced to leave her upscale city life and struggling to get used to her new home, spoiled teen Dani is given an orphaned horse to foster and train. In caring for her horse, Dani learns how to care for others and how to accept the changes in her life.",http://netflixroulette.net/api/posters/70288502.jpg,2016-05-02 20:45:31 UTC,2016-05-02 20:45:31 UTC
1091,Red Water,2003,3,Action & Adventure,"Lou Diamond Phillips, Kristy Swanson, Coolio, Jaimz Woolvett, Rob Boltin, Langley Kirkwood, Dennis Haskins, Gideon Emery",Charles Robert Carner,"While looking for a new energy source on the shores of a Louisiana river, a divorced couple put their differences aside. But their efforts are disrupted by a pair of thieves trying to retrieve pilfered treasure that lies at the bottom of the stream.",http://netflixroulette.net/api/posters/60034347.jpg,2016-05-02 20:45:31 UTC,2016-05-02 20:45:31 UTC
1092,What If...,2010,4,Faith and Spirituality,"Kevin Sorbo, Kristy Swanson, John Ratzenberger, Debby Ryan, Kristin Minter, Stelio Savante, Toni Trucks, Taylor Groothuis",Dallas Jenkins,"Would-be preacher Ben Walker (Kevin Sorbo) left his church and his college sweetheart, Wendy (Kristy Swanson), for a lucrative career, but when the slick executive's new ride breaks down, angelic tow-truck driver Mike (John Ratzenberger) offers to show where Ben's life might have gone. In this comedy of second chances, Ben awakens to find Wendy and their kids getting ready for church, while ahead of him lies a day of reckoning and reconsideration.",http://netflixroulette.net/api/posters/70170852.jpg,2016-05-02 20:45:31 UTC,2016-05-02 20:45:31 UTC
1093,Flowers in the Attic,1987,3,Dramas,"Louise Fletcher, Victoria Tennant, Kristy Swanson, Jeb Stuart Adams, Ben Ryan Ganger, Lindsay Parker, Marshall Colt, Nathan Davis, Brooke Fries, Alex Koba",Jeffrey Bloom,"After a tragic accident leaves them fatherless, four children move into their mother's mysterious family mansion in hopes of an inheritance. Instead, they are imprisoned by their evil grandmother, leaving them to survive a nightmare of cruelty.",http://netflixroulette.net/api/posters/60024210.jpg,2016-05-02 20:45:31 UTC,2016-05-02 20:45:31 UTC
1094,Beethoven's Treasure Tail,2014,3,Comedies,"Jonathan Silverman, Kristy Swanson, Bretton Manley, Jeffrey Combs, Alec Mapa, Jayne Eastwood, David DeLuise, Brian George, Udo Kier, Colin Mochrie",Ron Oliver,"After losing his job, America's beloved St. Bernard gets stranded in a small town and hunts for lost pirate treasure with a newfound friend.",http://netflixroulette.net/api/posters/80013076.jpg,2016-05-02 20:45:31 UTC,2016-05-02 20:45:31 UTC
1095,The Future,2013,2,Dramas,"Manuela Martelli, Rutger Hauer, Luigi Ciardo, Nicolas Vaporidis, Alessandro Giallocosta, Pino Calabrese",Alicia Scherson,"While struggling to care for her younger brother, an orphaned teen sets out to seduce a blind neighbor who's reputedly worth a fortune.",http://netflixroulette.net/api/posters/70268499.jpg,2016-05-02 20:45:31 UTC,2016-05-02 20:45:31 UTC
1096,Argento's Dracula,2012,2,Foreign Movies,"Thomas Kretschmann, Marta Gastini, Asia Argento, Unax Ugalde, Rutger Hauer, Maria Cristina Heller, Augusto Zucchi, Franco Ravera, Francesco Rossini, Giovanni Franzoni",Dario Argento,"When Englishman Jonathan Harker visits the exotic castle of Count Dracula, he is entranced by the mysterious aristocrat. But upon learning that the count has sinister designs on his wife, Mina, Harker seeks help from vampire slayer Van Helsing.",http://netflixroulette.net/api/posters/70242567.jpg,2016-05-02 20:45:31 UTC,2016-05-02 20:45:31 UTC
1097,Tactical Assault,1999,3,Action & Adventure,"Rutger Hauer, Robert Patrick, Isabel Glasser, Dey Young, Ken Howard, Barry Zetlin, Harri James, Tam Logan, Wendy Benson-Landes",Mark Griffiths,"During the Gulf War, two American fighter pilots make a routine reconnaissance sortie in the no-fly zone over Iraq. But when one of the men inexplicably attacks an Iraqi passenger jet full of innocent people, the other is forced to shoot him down.",http://netflixroulette.net/api/posters/18956748.jpg,2016-05-02 20:45:31 UTC,2016-05-02 20:45:31 UTC
1128,Big Top Pee-Wee,1988,3,Comedies,"Paul Reubens, Penelope Ann Miller, Kris Kristofferson, Valeria Golino, Wayne White, Susan Tyrrell, Albert Henderson, Jack Murdock, David Byrd, Mary Jackson",Randal Kleiser,Pee-Wee Herman joins the circus when a giant storm deposits a big-top tent -- and the menagerie to go with it -- in his front yard.,http://netflixroulette.net/api/posters/70000266.jpg,2016-05-02 20:45:34 UTC,2016-05-02 20:45:34 UTC
1098,Dracula III: Legacy,2005,3,Horror Movies,"Jason Scott Lee, Stephen Billington, Diane Neal, Jason London, Rutger Hauer, Ilinca Goia, George Grigore, Roy Scheider, Tom Kane, Alexandra Wescourt",Patrick Lussier,"In this direct-to-video sequel, Father Uffizi and Luke head to civil war-plagued Eastern Europe to save Elizabeth and destroy Dracula once and for all. Upon arriving, they learn that warlords are feeding inmates to the fanged creature of the night.",http://netflixroulette.net/api/posters/70003954.jpg,2016-05-02 20:45:31 UTC,2016-05-02 20:45:31 UTC
1099,Turbulence 3: Heavy Metal,2001,3,Action & Adventure,"Joe Mantegna, Craig Sheffer, Gabrielle Anwar, Rutger Hauer, John Mann, Monika Schnarre",Jorge Montesi,"Death metal superstar Slade Craven's plan to rock his fans at 30,000 feet with a one-of-a-kind concert aboard a 747 in mid-flight goes horribly awry when a psychotic passenger hijacks the plane and begins taking lives in indiscriminate fashion.",http://netflixroulette.net/api/posters/60021045.jpg,2016-05-02 20:45:31 UTC,2016-05-02 20:45:31 UTC
1100,Wilder,2000,3,Action & Adventure,"Pam Grier, Rutger Hauer, Romano Orzari, John Dunn-Hill, Eugene Clark, Serge Houde, Richard Robitaille, Simone-Elise Girard, Frank Schorpion, Sacha Dominique",Rodney Gibbons,"Sassy, sexy detective Della Wilder and her partner investigate a homicide case in which the main suspect is the victim's former lover. But when a second murder occurs, the evidence suggests that a big pharmaceutical company may be involved.",http://netflixroulette.net/api/posters/60028111.jpg,2016-05-02 20:45:31 UTC,2016-05-02 20:45:31 UTC
1101,Crusade of Vengeance,2002,3,Action & Adventure,"Rutger Hauer, Molly Culver, Joanna Pacula, Arnold Vosloo, John Vernon, Nina Young, Charlotte Avery, Sewell Whitney, Sander Kolosov, Vaidotas Martinaitis",Byron W. Thompson,"A female warrior heads home after fighting in the Crusades, only to return and find that her home has been attacked and her son has been taken from her. She sets off to find her young son and take down the evil force that divides her country.",http://netflixroulette.net/api/posters/70043235.jpg,2016-05-02 20:45:31 UTC,2016-05-02 20:45:31 UTC
1102,Black Butterflies,2011,3,Dramas,"Carice van Houten, Liam Cunningham, Rutger Hauer, Graham Clarke, Nicholas Pauling, Candice D'Arcy, Ceridwen Morris, Grant Swanby, Marthinus Van den Berg, Thamsanqua Mbongo",Paula van der Oest,"This passionate biopic profiles South African poet Ingrid Jonker, whose exuberant nature is destroyed by her repeated betrayals of her supportive lover and her complex relationship with her disapproving father, the minister of censorship.",http://netflixroulette.net/api/posters/70184136.jpg,2016-05-02 20:45:31 UTC,2016-05-02 20:45:31 UTC
1103,The Mill & The Cross,2011,3,Dramas,"Rutger Hauer, Charlotte Rampling, Michael York, Joanna Litwin, Dorota Lis, Marian Makula, Sylwia Szczerba, Wojciech Mierkulow",Lech Majewski,Flemish master Pieter Bruegel's 1564 painting The Procession to Calvary is transformed through amazing special effects into a big-screen epic in which Bruegel's artwork affects everyone around him -- including the Virgin Mary.,http://netflixroulette.net/api/posters/70167127.jpg,2016-05-02 20:45:31 UTC,2016-05-02 20:45:31 UTC
1104,Hobo with a Shotgun,2011,3,Action & Adventure,"Rutger Hauer, Pasha Ebrahimi, Robb Wells, Brian Downey, Gregory Smith, Nick Bateman, Drew O'Hara, Molly Dunsworth, Jeremy Akerman, Mark A. Owen",Jason Eisener,"This gleefully over-the-top revenge fantasy involves a bum who rolls into town hoping to start over, only to find his adopted city saturated in violence and ruled by a crime lord. The hobo's answer? Lay waste to every lowlife who crosses his path.",http://netflixroulette.net/api/posters/70167105.jpg,2016-05-02 20:45:31 UTC,2016-05-02 20:45:31 UTC
1105,Scorcher,2002,2,Action & Adventure,"Mark Dacascos, Mark Rolston, John Rhys-Davies, Tamara Davies, Rutger Hauer, Rayne Marcus, G.W. Bailey, Thomas F. Duffy, Sam Lloyd, Billy Maddox",James Seale,"A nuclear accident has caused the earth's tectonic plates to shift, creating earthquakes and volcanic eruptions in Southern California and pushing the Pacific plate to its breaking point.",http://netflixroulette.net/api/posters/60029315.jpg,2016-05-02 20:45:31 UTC,2016-05-02 20:45:31 UTC
1106,Scorpion King 4: Quest for Power,2015,3,Action & Adventure,"Barry Bostwick, M. Emmet Walsh, Lou Ferrigno, Don ""The Dragon"" Wilson, Victor Webster, Royce Gracie, Will Kemp, Ellen Hollman, Roy Nelson, Antonio Silva, Eve Torres, Michael Biehn, Rutger Hauer",Mike Elliott,"Hero Mathayus races against time tracking down a powerful treasure, before his former friend -- now an evil ruler -- finds it first and conquers all.",http://netflixroulette.net/api/posters/80013471.jpg,2016-05-02 20:45:31 UTC,2016-05-02 20:45:31 UTC
1107,The Club,1994,2,Horror Movies,"J.H. Wyman, Kim Coates, Andrea Roth, Rino Romano, Zack Ward, Kelli Taylor, Matthew Ferguson, Paul Popowich",Brenton Spencer,"Five students are faced with the ultimate moral dilemma when a student from a neighboring school stops time and forces them to join ""The Club."" Given the choice between murder or suicide, each student must face their fears before time starts again.",http://netflixroulette.net/api/posters/70264828.jpg,2016-05-02 20:45:32 UTC,2016-05-02 20:45:32 UTC
1108,Courage,2009,3,Faith and Spirituality,"Andrea Roth, Jason Priestley, Genevieve Buechner, Gabrielle Rose, John Shaw",George Erschbamer,"After their boat is wrecked by a vicious storm, a writer and his combative family are marooned on a tiny island in the middle of a raging river -- a dire situation that forces them to begin cooperating in order to survive their lethal predicament.",http://netflixroulette.net/api/posters/70184060.jpg,2016-05-02 20:45:32 UTC,2016-05-02 20:45:32 UTC
1109,Sasquatch,2003,2,Horror Movies,"Lance Henriksen, Andrea Roth, Russell Ferrier, Philip Granger, Jeremy Radick, Mary Mancini, Taras Kostyuk, Erica Parker",Jonas Quastel,"After finding the mutilated bodies of the crew of a downed plane in a forest, a rescue party realizes there's something deadly in the woods with them -- and they'll need to use a high-tech machine to find out what it is, and to make it out alive.",http://netflixroulette.net/api/posters/60026833.jpg,2016-05-02 20:45:32 UTC,2016-05-02 20:45:32 UTC
1110,The Stepdaughter,2000,3,Independent Movies,"Andrea Roth, Lisa Dean Ryan, Jaimz Woolvett, Cindy Pickett, Gil Gerard, Gary Hudson, Lee Dawson, Bonita Friedericy, Matt Farnsworth, J.J. Boone",Peter Liapis,"After a childhood spent going from one abusive foster home to the next, Susan seeks revenge on the mother who abandoned her. Susan's search leads her to a ranch where her long-lost sister begins to suspect the beautiful drifter isn't who she claims.",http://netflixroulette.net/api/posters/60003978.jpg,2016-05-02 20:45:32 UTC,2016-05-02 20:45:32 UTC
1111,Crazy for Christmas,2005,3,Dramas,"Andrea Roth, Howard Hesseman, Jason Spevack, Yannick Bisson, Karen LeBlanc, Daniel Fathers, Joyce Gordon, Mark Wilson",Eleanor Lindo,"A single mother is forced to chauffeur a wealthy man around town on Christmas Eve while he gives away cash to strangers. When a reporter pursues the story, a new romance blossoms and the single mother learns the true meaning of Christmas.",http://netflixroulette.net/api/posters/70245263.jpg,2016-05-02 20:45:32 UTC,2016-05-02 20:45:32 UTC
1112,The Skeptic,2009,3,Thrillers,"Tim Daly, Tom Arnold, Zoe Saldana, Edward Herrmann, Andrea Roth, Robert Prosky, Bruce Altman, Reila Aphrodite, Sara Weaver, Christina Rouner",Tennyson Bardwell,"Ignoring the odd circumstances of his aunt's death and ominous warnings about her abandoned Victorian, cynical attorney Bryan Beckett moves into the house. But before you can say ""boo,"" things that go bump in the night make him question his sanity.",http://netflixroulette.net/api/posters/70115875.jpg,2016-05-02 20:45:32 UTC,2016-05-02 20:45:32 UTC
1113,Rescue Me,2004,3,TV Shows,"Denis Leary, Michael Lombardi, Steven Pasquale, Andrea Roth, John Scurti, Daniel Sunjata, Callie Thorne, Natalie Distler, James McCaffrey, Lenny Clarke","","Haunted by ghosts from his past, veteran New York City firefighter Tommy Gavin struggles to keep his anxiety in check, look out for his fellow Engine 99 firefighters and handle the emotional turmoil that surfaces in his personal life.",http://netflixroulette.net/api/posters/70140429.jpg,2016-05-02 20:45:32 UTC,2016-05-02 20:45:32 UTC
1114,Down and Derby,2005,3,Children & Family Movies,"Greg Germann, Lauren Holly, Pat Morita, Adam Hicks, Perry Anzilotti, Deborah Ashton, Danny Shepherd, Ross Brockley, Tammy Lier, Hunter Tylo",Eric Hendershot,"A small-town Pinewood Derby competition transforms an average group of dads into desperate competitors who live out their triumphal fantasies through their kids. Hilarity ensues as dads resort to backstabbing, cover-ups and sabotage.",http://netflixroulette.net/api/posters/70027112.jpg,2016-05-02 20:45:33 UTC,2016-05-02 20:45:33 UTC
1115,Satin,2011,2,Comedies,"Hamilton von Watts, Melissa Joan Hart, Robert Guillaume, Alley Mills, Perry Anzilotti, Chip Bent, Michael Cudlitz, Jackie Debatin, Stacey Travis, Victor Rivers",Chris Olness,"When his Cadillac breaks down in the middle of the desert, struggling singer Jack Satin takes a breather in the town of Lost Springs, where a former jazz legend and a local barkeeper inspire him to write lyrics about something real.",http://netflixroulette.net/api/posters/70170749.jpg,2016-05-02 20:45:33 UTC,2016-05-02 20:45:33 UTC
1116,Rush: Beyond the Lighted Stage,2010,4,Documentaries,"Rush, Geddy Lee, Neil Peart, Alex Lifeson, Billy Corgan, Gene Simmons, Jack Black, Les Claypool, Matt Stone","Sam Dunn, Scot McFadyen","Celebrate the remarkable 40-year career of influential Canadian rock band Rush with this music documentary, which details the band's formation, long list of hit albums, struggles with critics, musical evolution and present day identity. Featuring interviews with well-known Rush fans such as Billy Corgan, Gene Simmons and Jack Black, this Rush extravaganza will thrill fans with its awesome archival footage and soundtrack.",http://netflixroulette.net/api/posters/70137744.jpg,2016-05-02 20:45:33 UTC,2016-05-02 20:45:33 UTC
1117,Nacho Libre,2006,3,Children & Family Movies,"Jack Black, Ana de la Reguera, Héctor Jiménez, Darius Rose, Moises Arias, Diego Eduardo Gomez, Carlos Maycotte, Richard Montoya, Cesar Gonzalez, Rafael Montalvo",Jared Hess,"Ignacio works as a cook at the Mexican monastery where he spent his youth. When he learns of the orphanage's financial woes, he pitches in to help -- by disguising himself and joining the professional wrestling circuit as a luchador named Nacho.",http://netflixroulette.net/api/posters/70044883.jpg,2016-05-02 20:45:33 UTC,2016-05-02 20:45:33 UTC
1118,Bongwater,1997,2,Comedies,"Jamie Kennedy, Alicia Witt, Amy Locane, Brittany Murphy, Scott Caan, Jack Black, Andy Dick, Jeremy Sisto, Luke Wilson",Richard Sears,"Luke Wilson stars as David, a pot-smoking artist who's desperately in love with sensual Serena. Sadly, the two have a misunderstanding and, just as David's house burns to the ground, Serena dumps him in favor of junkie Tommy.",http://netflixroulette.net/api/posters/70027862.jpg,2016-05-02 20:45:33 UTC,2016-05-02 20:45:33 UTC
1119,Kung Fu Panda: Holiday,2010,3,Children & Family Movies,"Jack Black, Angelina Jolie, Dustin Hoffman, Jackie Chan, Seth Rogen, Lucy Liu, David Cross, James Hong, Dan Fogler",Tim Johnson,"As preparations for the Winter Feast build, Po is caught between his obligations as the Dragon Warrior and his family holiday traditions. In the end, he follows his heart and shows both the villagers and the palace the true meaning of community.",http://netflixroulette.net/api/posters/70253397.jpg,2016-05-02 20:45:33 UTC,2016-05-02 20:45:33 UTC
