id,title,year,rating,category,cast,director,summary,poster,created_at,updated_at
731,Flight of the Intruder,1991,3,Action & Adventure,"Danny Glover, Willem Dafoe, Brad Johnson, Rosanna Arquette, Tom Sizemore, J. Kenneth Campbell, Jared Chandler, Dann Florek, Madison Mason, Ving Rhames",John Milius,This action thriller follows two Navy pilots in the Vietnam War who plot to bombard Hanoi's People's Resistance Park against government orders.,http://netflixroulette.net/api/posters/60028612.jpg,2016-04-29 16:22:17 UTC,2016-04-29 16:22:17 UTC
732,The Snitch Cartel,2011,3,Foreign Movies,"Manolo Cardona, Juana Acosta, Diego Cadavid, Robinson Díaz, Julián Arango, Andrés Parra, Tom Sizemore, Kuno Becker, Pedro Armendáriz Jr., Adriana Barraza, Fernando Solórzano, Juan Pablo Raba",Carlos Moreno,"Struggling to rise above his working-class origins, Martin Gonzalez begins selling drugs for the brutal North Valley Cartel.",http://netflixroulette.net/api/posters/70263187.jpg,2016-04-29 16:22:17 UTC,2016-04-29 16:22:17 UTC
733,Roger Dodger,2002,2,Comedies,"Campbell Scott, Jesse Eisenberg, Isabella Rossellini, Elizabeth Berkley, Jennifer Beals, Mina Badie, Ben Shenkman, Chris Stack, Gabriel Millman, Colin Fickes",Dylan Kidd,"A cynical advertising copywriter tries to teach his teenage nephew the art of manipulating women, but his seemingly foolproof methods unravel.",http://netflixroulette.net/api/posters/60024998.jpg,2016-04-29 16:22:17 UTC,2016-04-29 16:22:17 UTC
734,Flashdance,1983,3,Dramas,"Jennifer Beals, Michael Nouri, Lilia Skala, Sunny Johnson, Kyle T. Heffner, Lee Ving, Ron Karabatsos, Belinda Bauer, Robert Wuhl",Adrian Lyne,"Alex works as a welder by day and a stripper by night, but she dreams of training at the local conservatory and becoming a professional dancer. Meanwhile, she navigates a romance with her boss at the steelyard.",http://netflixroulette.net/api/posters/60010351.jpg,2016-04-29 16:22:17 UTC,2016-04-29 16:22:17 UTC
735,The Prophecy 2,1998,3,Horror Movies,"Christopher Walken, Russell Wong, Jennifer Beals, Brittany Murphy, Eric Roberts, Glenn Danzig, Steve Hytner, Bruce Abbott, Danny Strong, Elizabeth Dennehy",Greg Spence,"Kicked out of his asylum in hell, fallen angel Gabriel continues his revolution, in which bad angels seek to destroy good ones -- along with all humanity. The only hope for deliverance is the unborn child of nurse Valerie Rosales.",http://netflixroulette.net/api/posters/8177459.jpg,2016-04-29 16:22:17 UTC,2016-04-29 16:22:17 UTC
736,The Thief and the Cobbler,1993,3,Children & Family Movies,"Vincent Price, Matthew Broderick, Jennifer Beals, Eric Bogosian, Toni Collette, Jonathan Winters, Bobbi Page, Clive Revill, Kevin Dorsey, Stanley Baxter",Richard Williams,"In this colorful animated fantasy, a modest cobbler who pines for a beautiful princess has a chance to win her heart by doing battle with an evil sorcerer and saving her father's kingdom from a marauding army of one-eyed warriors.",http://netflixroulette.net/api/posters/70034253.jpg,2016-04-29 16:22:17 UTC,2016-04-29 16:22:17 UTC
737,Wishful Thinking,1999,2,Comedies,"Drew Barrymore, Jennifer Beals, James Le Gros, Jon Stewart, Mel Gorham, Eric Thal, Desiree Casado, Lázaro Pérez",Adam Park,"When Max meets Elizabeth, there's a connection, but when Elizabeth starts talking marriage, Max pushes her away. Meanwhile, Elizabeth's friendship with Jack makes Max jealous, and Max's co-worker Lena jumps at the chance to win Max for herself.",http://netflixroulette.net/api/posters/60001463.jpg,2016-04-29 16:22:17 UTC,2016-04-29 16:22:17 UTC
738,Four Rooms,1995,3,Comedies,"Tim Roth, Antonio Banderas, Jennifer Beals, Bruce Willis, Paul Calderon, Madonna, Marisa Tomei, Quentin Tarantino, Ione Skye, Lili Taylor","Quentin Tarantino, Robert Rodriguez, Allison Anders, Alexandre Rockwell","One mad New Year's Eve, an overwhelmed bellboy copes with witches and diabolical children, gets caught in the middle of a sour relationship and settles a bloody bet for members of a superstar's entourage.",http://netflixroulette.net/api/posters/520179.jpg,2016-04-29 16:22:17 UTC,2016-04-29 16:22:17 UTC
739,The Chicago Code,2011,4,TV Shows,"Jason Clarke, Jennifer Beals, Matt Lauria, Devin Kelley, Todd Williams, Billy Lush, Delroy Lindo, Paolina Cimino","","Newly appointed police superintendant Teresa Colvin and her former partner, veteran detective Jarek Wysocki, battle to rid Chicago of crime as well as the rampant corruption of powerful politico Ronin Gibbons in this gritty cop drama.",http://netflixroulette.net/api/posters/70177070.jpg,2016-04-29 16:22:17 UTC,2016-04-29 16:22:17 UTC
740,The L Word,2004,3,"Dramas
","Jennifer Beals, Leisha Hailey, Laurel Holloman, Mia Kirshner, Katherine Moennig, Pam Grier, Rachel Shelley, Daniela Sea, Erin Daniels, Marlee Matlin","",This trailblazing cable series follows the tangled lives and ever-changing relationships among a close-knit group of lesbians -- including a lusty hairstylist and a recovering alcoholic -- who call Los Angeles home.,http://netflixroulette.net/api/posters/70136114.jpg,2016-04-29 16:22:17 UTC,2016-04-29 16:22:17 UTC
741,The Bride,1985,2,Dramas,"Sting, Jennifer Beals, Anthony Higgins, Clancy Brown, David Rappaport, Geraldine Page, Alexei Sayle, Phil Daniels, Veruschka von Lehndorff, Quentin Crisp",Franc Roddam,Frankenstein and his creations need a place in the world: lovely Eva must declare her sexual independence while her grotesque mate gains self-esteem.,http://netflixroulette.net/api/posters/60021100.jpg,2016-04-29 16:22:17 UTC,2016-04-29 16:22:17 UTC
742,Cinemanovels,2013,2,Independent Movies,"Lauren Lee Smith, Jennifer Beals, Ben Cotton, Sarah Grey, Katharine Isabelle, Kett Turton, Viv Leacock, Gabrielle Rose, Jerry Wasserman, Erica Carroll",Terry Miles,"As a young woman prepares a retrospective of her recently deceased director father's work, his movies begin to affect her in unexpected ways.",http://netflixroulette.net/api/posters/70293867.jpg,2016-04-29 16:22:17 UTC,2016-04-29 16:22:17 UTC
743,Caribe,1987,2,Action & Adventure,"John Savage, Kara Glover, Stephen McHattie, Sam Malkin, Zack Nesis, Paul Koslo, Maury Chaykin, T.J. Scott",Michael Kennedy,"Prepare to get tangled in the jungles of Belize when an arms smuggler loses her partner in a deadly shootout and finds herself on the run in the tropics of Central America.  Helen is an amateur, making her money as an illegal arms trader to Central American terrorists.",http://netflixroulette.net/api/posters/70231574.jpg,2016-04-29 16:22:17 UTC,2016-04-29 16:22:17 UTC
744,Mouse Hunt,1997,3,Children & Family Movies,"Nathan Lane, Lee Evans, Vicki Lewis, Maury Chaykin, Eric Christmas, Michael Jeter, Debra Christofferson, Camilla Søeberg, Christopher Walken",Gore Verbinski,"Two down-on-their-luck brothers inherit a run-down mansion that turns out to be worth millions. They can sell it and pocket a fortune, but first they have to evict its diminutive tenant: a mouse with no intention of leaving.",http://netflixroulette.net/api/posters/1181479.jpg,2016-04-29 16:22:17 UTC,2016-04-29 16:22:17 UTC
745,Jerry and Tom,1998,3,Comedies,"Joe Mantegna, Sam Rockwell, Maury Chaykin, Ted Danson, Charles Durning, William H. Macy, Peter Riegert, Sarah Polley, Shelley Cook",Saul Rubinek,"Easygoing family man Tom (Joe Mantegna) -- used-car salesman by day, mob enforcer by night -- shows his brash co-worker Jerry (Sam Rockwell) the ropes of contract killing. Soon the young apprentice not only gets the hang of it but begins to enjoy killing strangers for money. For his directorial debut, Saul Rubinek assembled a formidable supporting cast that includes William H. Macy, Ted Danson and Charles Durning.",http://netflixroulette.net/api/posters/60001921.jpg,2016-04-29 16:22:17 UTC,2016-04-29 16:22:17 UTC
746,Camilla,1994,3,Comedies,"Jessica Tandy, Bridget Fonda, Elias Koteas, Graham Greene, Hume Cronyn, Maury Chaykin",Deepa Mehta,"Camilla is a heartwarming comedy about two women (Jessica Tandy and Bridget Fonda) who become fast friends and hit the road for the adventure of a lifetime. While a confused husband, a desperate son, and a long-lost love frantically try to track them down, the women find themselves in some funny situations, including losing their car in a lake, being duped by a con man, and staging a kidnapping.",http://netflixroulette.net/api/posters/346076.jpg,2016-04-29 16:22:17 UTC,2016-04-29 16:22:17 UTC
747,Wilby Wonderful,2004,3,Comedies,"James Allodi, Maury Chaykin, Paul Gross, Rebecca Jenkins, Sandra Oh, Ellen Page, Callum Keith Rennie, Daniel MacIvor, Susannah Hoffman",Daniel MacIvor,"Within 24 hours at a sleepy Nova Scotia community, a town scandal looms on the horizon; a store clerk repeatedly attempts suicide (even as a handyman repeatedly interrupts him); and an uptight real estate agent drifts apart from her husband, a cop.",http://netflixroulette.net/api/posters/70046347.jpg,2016-04-29 16:22:17 UTC,2016-04-29 16:22:17 UTC
748,The Hunt for the BTK Killer,2005,3,Dramas,"Robert Forster, Michael Michele, Maury Chaykin, Mimi Kuzyk, Gregg Henry, Johnie Chase, Martha Irving, Nigel Bennett, Hollis McLaren, Andrew Airlie",Stephen T. Kay,"This chilling fact-based drama chronicles the story of Dennis Rader, who was dubbed the BTK killer because he bound, tortured and killed his victims. Rader murdered 10 people in Wichita, Kan. -- and remained at large for more than 30 years.",http://netflixroulette.net/api/posters/70062560.jpg,2016-04-29 16:22:17 UTC,2016-04-29 16:22:17 UTC
749,NYC 22,2012,3,TV Shows,"Adam Goldberg, Leelee Sobieski, Stark Sands, Judy Marte, Harold House Moore, Tom Reed, Felix Solis, Terry Kinney","","Six rookie cops hit the streets of Manhattan, juggling their personal lives with their new responsibilities as keepers of the peace. The diverse group struggles with newbie mistakes under the guidance of their tough field training officer.",http://netflixroulette.net/api/posters/70197059.jpg,2016-04-29 16:22:17 UTC,2016-04-29 16:22:17 UTC
750,Canterbury's Law,2008,3,TV Shows,"Julianna Margulies, Ben Shenkman, Keith Robinson, Trieste Dunn, Terry Kinney, Aidan Quinn","","Julianna Margulies stars in this drama as spirited attorney Elizabeth Canterbury, a woman who balances her desire to help others seek justice with her own ongoing struggle to deal with her son's unsolved disappearance.",http://netflixroulette.net/api/posters/70202741.jpg,2016-04-29 16:22:17 UTC,2016-04-29 16:22:17 UTC
751,A Life Less Ordinary,1997,3,Comedies,"Ewan McGregor, Cameron Diaz, Holly Hunter, Delroy Lindo, Dan Hedaya, Ian McNeice, Frank Kanig, Mel Winkler, Stanley Tucci, Anne Cullimore Decker",Danny Boyle,"Determined to live ""a life less ordinary,"" Robert (Ewan McGregor), a down-and-out janitor, kidnaps narcissistic heiress Celine (Cameron Diaz) in hopes of pulling in a big ransom. Unfortunately for Robert, Celine embraces her life as a captive and enjoys Robert's bungling attempt at retrieving a payoff. Add two angels (Delroy Lindo and Holly Hunter) who try to make Robert and Celine fall in love, and the situation becomes extraordinary.",http://netflixroulette.net/api/posters/1179373.jpg,2016-04-29 16:22:17 UTC,2016-04-29 16:22:17 UTC
752,Pumpkin,2002,3,Comedies,"Christina Ricci, Hank Harris, Brenda Blethyn, Dominique Swain, Marisa Coughlan, Sam Ball, Harry Lennix, Nina Foch, Caroline Aaron, Lisa Banes","Anthony Abrams, Adam Larson Broder","A perky sorority sister is assigned to coach a young man named Pumpkin, a mentally challenged athlete who ultimately touches her heart.",http://netflixroulette.net/api/posters/60022994.jpg,2016-04-29 16:22:17 UTC,2016-04-29 16:22:17 UTC
753,Tiger Woods Story,1998,3,Dramas,"Keith David, Khalil Kain, Freda Foh Shen, Gary Leroi Gray, T.J. Hall, John Cho, David Grant Wright, Kathryne Dora Brown, Albert Hall",LeVar Burton,"With his father coaching him and his mother providing a strong spiritual influence, Tiger Woods rose to fame and fortune. But his success came at a price, as he endured personal struggles with racism, self-doubt and cultural identity.",http://netflixroulette.net/api/posters/70175611.jpg,2016-04-29 16:22:17 UTC,2016-04-29 16:22:17 UTC
754,Ally McBeal,1997,3,TV Shows,"Calista Flockhart, Greg Germann, Jane Krakowski, Peter MacNicol, Portia de Rossi, Lucy Liu, Courtney Thorne-Smith, Lisa Nicole Carson, Vonda Shepard, Albert Hall","","Calista Flockhart stars in this Emmy-winning dramedy as Ally McBeal, an endearingly unlucky-in-love Boston attorney who takes on peculiar cases while resisting feelings for her colleague (and former beau), Billy.",http://netflixroulette.net/api/posters/70157513.jpg,2016-04-29 16:22:17 UTC,2016-04-29 16:22:17 UTC
755,Apocalypse Now Redux,2001,4,Action & Adventure,"Martin Sheen, Marlon Brando, Robert Duvall, Frederic Forrest, Sam Bottoms, Laurence Fishburne, Albert Hall, Dennis Hopper, Harrison Ford, G.D. Spradlin",Francis Ford Coppola,The reedit of this Vietnam War epic that follows an Army captain's search for a renegade colonel features new footage and a fade-to-black ending.,http://netflixroulette.net/api/posters/70150471.jpg,2016-04-29 16:22:17 UTC,2016-04-29 16:22:17 UTC
756,Apocalypse Now,1979,4,Dramas,"Martin Sheen, Marlon Brando, Robert Duvall, Frederic Forrest, Sam Bottoms, Laurence Fishburne, Albert Hall, Dennis Hopper, Harrison Ford, G.D. Spradlin",Francis Ford Coppola,"During the Vietnam War, Capt. Willard is sent to Cambodia on a top-secret mission to terminate Col. Kurtz, who's gone completely insane.",http://netflixroulette.net/api/posters/262839.jpg,2016-04-29 16:22:17 UTC,2016-04-29 16:22:17 UTC
757,Eve's Bayou,1997,3,Independent Movies,"Samuel L. Jackson, Lynn Whitfield, Debbi Morgan, Vondie Curtis-Hall, Jurnee Smollett, Meagan Good, Diahann Carroll, Lisa Nicole Carson, Branford Marsalis, Marcus Lyle Brown",Kasi Lemmons,"The wife of a physician in 1960s Louisiana ignores his infidelities, but his daughter is crushed when she catches her dad in a compromising position.",http://netflixroulette.net/api/posters/1179987.jpg,2016-04-29 16:22:17 UTC,2016-04-29 16:22:17 UTC
758,The Brooke Ellison Story,2004,3,Dramas,"Mary Elizabeth Mastrantonio, John Slattery, Lacey Chabert, Vanessa Marano, Jenson Goins, Devon Gearhart, Lauren Barrett, Ryan Hudson, Luke Flynn, John P. Fertitta",Christopher Reeve,"On her way home from school, 11-year-old Brooke Ellison's life is radically transformed after a car accident leaves her a paraplegic.",http://netflixroulette.net/api/posters/70032185.jpg,2016-04-29 16:22:17 UTC,2016-04-29 16:22:17 UTC
759,Dirty Deeds,2005,3,Comedies,"Milo Ventimiglia, Lacey Chabert, Tom Amandes, Matthew Carey, Charles Durning, Michael Milhoan, Billy L. Sullivan, Zoe Saldana, Arielle Kebbel, Ray Santiago",David Kendall,"To score points with the girl of his dreams (Lacey Chabert), West Valley High senior Zach Harper (Milo Ventimiglia) signs on for the school's definitive test of manhood: making it through a string of 10 challenges known as the ""Dirty Deeds."" But as Zach goes all out to complete the list in the allotted 12 hours, an obnoxious jock (Matthew Carey) and his bully cohorts toss obstacles in Zach's way. Zoe Saldana co-stars as a gorgeous alumna.",http://netflixroulette.net/api/posters/70038786.jpg,2016-04-29 16:22:17 UTC,2016-04-29 16:22:17 UTC
760,Bratz Go To Paris,2013,3,Children & Family Movies,"Olivia Hack, Soleil Moon Frye, Tia Mowry-Hardrict, Dionne Quan, Wendie Malick, Lacey Chabert, Kaley Cuoco, Charlie Schlatter, Ogie Banks, Greg Ellis",Mucci Fassett,"When someone poisons popular models in Paris, Cloe, Yasmin, Jade and Sasha go undercover as supermodels to solve the mystery. There is no mystery that the Bratz cannot solve with teamwork!",http://netflixroulette.net/api/posters/70290961.jpg,2016-04-29 16:22:17 UTC,2016-04-29 16:22:17 UTC
761,Slightly Single in L.A.,2012,3,Comedies,"Lacey Chabert, Jenna Dewan-Tatum, Jonathan Bennet, Mircea Monroe, Kip Pardue, Haylie Duff, Simon Rex, Charlie Bewley, Carley Schroeder, Chris Kattan",Christie Will,"Dale was excited to move to L.A., but everything in her life -- work, friends, romance -- is going wrong. Now she's caught in a love triangle with her best friend and a guy from her past, and turning her luck around will take a huge leap of faith.",http://netflixroulette.net/api/posters/70284284.jpg,2016-04-29 16:22:17 UTC,2016-04-29 16:22:17 UTC
762,"Hello Sister, Goodbye Life",2006,3,Dramas,"Lacey Chabert, Sammi Hanratty, Wendie Malick, David Ramsey, Adam Kaufman, Amanda Baker, Brandi Coleman, Erin Fisk",Steven Robman,"Olivia Martin's life as a spoiled, self-obsessed college student changes forever when her estranged father and stepmother die in a car crash, leaving her the guardian of her 7-year-old half sister and forcing her to take on adult responsibilities.",http://netflixroulette.net/api/posters/70216138.jpg,2016-04-29 16:22:17 UTC,2016-04-29 16:22:17 UTC
763,Being Michael Madsen,2007,2,Comedies,"Michael Madsen, Jason Alan Smith, Doug Tompos, Kathy Searle, Davis Mikaels, Virginia Madsen, Daryl Hannah, David Carradine, Lacey Chabert, Harry Dean Stanton",Michael Mongillo,"Michael Madsen's played a lot of unsavory characters on screen, but could he possibly be a murderer in real life? That's the starting point for this ""meta"" mockumentary, in which a paparazzi starts the vicious rumor.",http://netflixroulette.net/api/posters/70138979.jpg,2016-04-29 16:22:17 UTC,2016-04-29 16:22:17 UTC
764,Be My Baby,2006,3,Comedies,"Lacey Chabert, Brody Hutzler, Julia Duffy, René Ashton, Cris Judd, Josie Davis, Tara Mercurio, Bru Muller, Rance Howard, Jonathan Breck",Bryce Olson,"Tired of being duped by cheating husbands pretending to be single, Rylee decides to get revenge by having one-night stands with married men and then showing up months later with a baby, demanding money. But her plan soon goes awry.",http://netflixroulette.net/api/posters/70068660.jpg,2016-04-29 16:22:17 UTC,2016-04-29 16:22:17 UTC
765,Daddy Day Care,2003,3,Children & Family Movies,"Eddie Murphy, Jeff Garlin, Steve Zahn, Regina King, Kevin Nealon, Jonathan Katz, Siobhan Fallon, Lisa Edelstein, Lacey Chabert, Laura Kightlinger",Steve Carr,"When a conscientious father loses his lucrative dot-com job and faces economic ruin, he joins two friends in opening a business called Daddy Day Care. But as the venture takes off, it attracts the attention of a rival who doesn't like competition.",http://netflixroulette.net/api/posters/60027689.jpg,2016-04-29 16:22:17 UTC,2016-04-29 16:22:17 UTC
766,Transformers: Rescue Bots,2011,3,TV Shows,"Lacey Chabert, Elan Garfias, Maurice LaMarche, Jason Marsden, Shannon McKain, Steve Blum, Parvesh Cheena, D.C. Douglas, Imari Williams, LeVar Burton","","Together with human counterparts who are a family of emergency responders, four young transformers, Heatwave, Chase, Blades and Boulder, are tasked by Optimus Prime to protect and study the ways of humanity on the island of Griffin Rock.",http://netflixroulette.net/api/posters/70259208.jpg,2016-04-29 16:22:17 UTC,2016-04-29 16:22:17 UTC
767,An American Tail: The Mystery of the Night Monster,1999,3,Children & Family Movies,"Thomas Dekker, Lacey Chabert, Jane Singer, Nehemiah Persoff, Susan Boyd, Robert Hays, Pat Musick, Dom DeLuise, Candi Milo, Jeff Bennett",Larry Latham,"Lacey Chabert and Dom DeLuise lend their voices to this installment of the enchanting American Tail series of animated classics. In this segment, pure-hearted Fievel the mouse is joined by his sister Tanya in a crime-fighting caper.",http://netflixroulette.net/api/posters/60033786.jpg,2016-04-29 16:22:17 UTC,2016-04-29 16:22:17 UTC
768,Little Voice,1998,3,Comedies,"Brenda Blethyn, Jane Horrocks, Ewan McGregor, Philip Jackson, Annette Badland, Michael Caine, Jim Broadbent, Adam Fogerty, James Welsh, Karen Gregory",Mark Herman,"A telephone repairman and a music promoter play second fiddle to Little Voice, a young woman whose beautiful pipes could pack a thousand cabarets. Trouble is, she can only sing along to records in her room.",http://netflixroulette.net/api/posters/18169499.jpg,2016-04-29 16:22:17 UTC,2016-04-29 16:22:17 UTC
769,Daddy & Them,2001,3,Comedies,"Billy Bob Thornton, Laura Dern, Diane Ladd, Kelly Preston, Jim Varney, Jamie Lee Curtis, Ben Affleck, Andy Griffith, Brenda Blethyn",Billy Bob Thornton,"In this dark slice-of-life comedy, an Arkansas clan -- including good ol' boy Claude Montgomery and his green-eyed wife -- travels to Little Rock to help a recently jailed relative. But the minute they unpack their bags, family infighting erupts.",http://netflixroulette.net/api/posters/60032950.jpg,2016-04-29 16:22:17 UTC,2016-04-29 16:22:17 UTC
770,Undertaking Betty,2002,3,Comedies,"Brenda Blethyn, Alfred Molina, Christopher Walken, Naomi Watts, Lee Evans, Robert Pugh, Ena Cohen, Menna Trussler, Miriam Margolyes, Jerry Springer",Nick Hurran,"Welsh funeral parlor owner Boris is about to realize his fondest dream. His true love since childhood will soon make herself available to him -- by staging her own fake death. But as part of the bargain, Boris may have to sacrifice his business.",http://netflixroulette.net/api/posters/70000102.jpg,2016-04-29 16:22:17 UTC,2016-04-29 16:22:17 UTC
771,Night Train,1998,3,Dramas,"John Hurt, Brenda Blethyn, Pauline Flanagan, Rynagh O'Grady, Peter Caffrey, Paul Roe, Lorcan Cranitch, Cathy White",John Lynch,"After a stint in prison for embezzling a gangster's purloined loot, an ex-con moves from the frying pan into the fire: He has to find somewhere to hide out immediately or else he'll be killed by the mobster and his men.",http://netflixroulette.net/api/posters/70007709.jpg,2016-04-29 16:22:17 UTC,2016-04-29 16:22:17 UTC
772,London River,2009,3,Dramas,"Brenda Blethyn, Sotigui Kouyaté, Roschdy Zem, Sami Bouajila, Bernard Blancan, Marc Baylis, Gareth Randall, Aurelie Eltvedt, Francis Magee, Mathieu Schiffman",Rachid Bouchareb,"After the terrorist bombings of July 7, 2005, Mrs. Sommers and Ousmane each travel to London to find their missing children. From divergent backgrounds but united by their search, they find common ground in the hope that their children survived.",http://netflixroulette.net/api/posters/70114350.jpg,2016-04-29 16:22:17 UTC,2016-04-29 16:22:17 UTC
773,Vera,2011,3,TV Shows,"Brenda Blethyn, David Leon, Paul Ritter, Jon Morrison, Tom Hutch, Clare Calbraith, Wunmi Mosaku, Sonya Cassidy","","Based on Ann Cleeves's Vera Stanhope novels, this detective series focuses on the tireless Detective Chief Inspector Stanhope -- played by Brenda Blethyn -- as she solves a series of baffling homicides in scenic Northumberland County.",http://netflixroulette.net/api/posters/70198119.jpg,2016-04-29 16:22:17 UTC,2016-04-29 16:22:17 UTC
774,Fly Me to the Moon,2008,3,Children & Family Movies,"Christopher Lloyd, Kelly Ripa, Nicollette Sheridan, Tim Curry, Trevor Gagnon, Philip Bolden, David Gore, Ed Begley Jr., Adrienne Barbeau, Robert Patrick",Ben Stassen,"Three ordinary flies have the adventure of their lives when they stow away on Apollo 11 for its trip to the moon. As friends and family anxiously watch the lunar landing on television, the trio makes a crucial repair that could save the mission.",http://netflixroulette.net/api/posters/70089216.jpg,2016-04-29 16:22:17 UTC,2016-04-29 16:22:17 UTC
775,Clue,1985,3,Comedies,"Eileen Brennan, Tim Curry, Madeline Kahn, Christopher Lloyd, Michael McKean, Martin Mull, Lesley Ann Warren, Colleen Camp, Lee Ving, Bill Henderson",Jonathan Lynn,"Director Jonathan Lynn's board game-inspired campfest finds six colorful dinner guests gathered at a mansion, where they all become suspects in the death of the house's owner, who had been blackmailing each of them.",http://netflixroulette.net/api/posters/60001070.jpg,2016-04-29 16:22:17 UTC,2016-04-29 16:22:17 UTC
776,Tales from the Crypt: Ritual,2002,3,Horror Movies,"Jennifer Grey, Craig Sheffer, Daniel Lapaine, Kristen Wilson, Gabriel Casseus, Tim Curry",Avi Nesher,"Stripped of her license, Dr. Alice Dodgson moves to Jamaica and accepts a job ministering to a man who claims to be hexed by voodoo curse. As Alice is drawn into the world of the supernatural, she finds her staunch belief in science put to the test.",http://netflixroulette.net/api/posters/70046864.jpg,2016-04-29 16:22:17 UTC,2016-04-29 16:22:17 UTC
777,Saving Santa,2013,3,Children & Family Movies,"Martin Freeman, Ashley Tisdale, Tim Curry, Joan Collins, Pam Ferris, Tim Conway, Noel Clarke","Leon Joosen, Aaron Seelman","At the North Pole, Bernard, a low-ranking elf, dreams of joining Santa's elite team of innovators. When the location of Santa's workshop is accidentally revealed, Santa and Christmas are in jeopardy. Can Bernard rescue Santa in time for Christmas?",http://netflixroulette.net/api/posters/70296220.jpg,2016-04-29 16:22:17 UTC,2016-04-29 16:22:17 UTC
778,Koala Kid,2012,3,Children & Family Movies,"Rob Schneider, Bret McKenzie, Yvonne Strahovski, Alan Cumming, Frank Welker, Norm MacDonald, Jenni Pulos, Tim Curry, Charlie Bewley, Chris Edgerly",Kyung Ho Lee,"Tired of being teased for his color, a white koala joins a traveling carnival with a Tasmanian devil and a photographer monkey as talent agents. Their adventures take an unexpected turn when their trailer crashes, leaving them stranded in the desert.",http://netflixroulette.net/api/posters/70274890.jpg,2016-04-29 16:22:17 UTC,2016-04-29 16:22:17 UTC
779,Congo,1995,3,Action & Adventure,"Dylan Walsh, Laura Linney, Ernie Hudson, Tim Curry, Joe Don Baker, Grant Heslov, Adewale Akinnuoye-Agbaje, Mary Ellen Trainor",Frank Marshall,"Eight people go on an expedition into the Congo, an expanse of Africa where the laws of nature have gone berserk. When the thrill-seekers, some with ulterior motives, stumble across a race of killer apes, they must fight their way out of the dark.",http://netflixroulette.net/api/posters/394784.jpg,2016-04-29 16:22:17 UTC,2016-04-29 16:22:17 UTC
